User Input,Chatbot Response,Timestamp
hello,Hi there,2024-09-10 01:21:51
how are you ,My purpose is to assist you,2024-09-10 01:21:57
weather ,"I'm sorry, I cannot provide real-time weather information.",2024-09-10 01:22:20
How do I create a budget,"To make a budget, start by tracking your income and expenses. Then, allocate your income towards essential expenses like rent, food, and bills. Next, allocate some of your income towards savings and debt repayment. Finally, allocate the remainder of your income towards discretionary expenses like entertainment and hobbies.",2024-09-10 01:22:30
Today is a nice weather,"I'm sorry, I cannot provide real-time weather information.",2024-10-03 08:29:52
How's the weather today,"I'm sorry, I cannot provide real-time weather information.",2024-10-03 08:30:47
Hi,Hello,2024-10-03 08:30:56
hello,Hi there!,2025-05-15 20:27:24
who are you,"I'm fine, thank you!",2025-05-15 20:28:02
Who are you,"All good here, thanks!",2025-05-15 20:28:36
What can you do,"Gardening tips include choosing the right plants for your climate, watering properly, and using organic fertilizers.",2025-05-15 20:29:21
What are you,"Doing well, how about you?",2025-05-15 20:30:23
Who are you,I am a chatbot,2025-05-15 20:31:53
What ,My purpose is to assist you,2025-05-15 20:32:18
What is your purpose,My purpose is to assist you,2025-05-15 20:32:33
how are you,Hey,2025-05-16 09:29:46
How are you,Hey,2025-05-16 09:29:52
What is your purpose,I can answer questions and provide assistance,2025-05-16 09:30:08
What is your age,My purpose is to assist you,2025-05-16 09:31:53
how old are you,I can answer questions and provide assistance,2025-05-16 09:32:22
How old are you,My purpose is to assist you,2025-05-16 09:32:40
What's your age,"Reading books can broaden your knowledge, enhance creativity, and provide a great way to relax.",2025-05-16 09:32:59
hii,"Gardening tips include choosing the right plants for your climate, watering properly, and using organic fertilizers.",2025-05-16 09:33:07
Hello,Nothing much,2025-05-16 09:33:15
good morning,Growing a vegetable garden allows you to enjoy fresh produce and connect with nature.,2025-05-16 09:34:16
what is your purpose,I can answer questions and provide assistance,2025-05-16 09:34:31
hello,Nothing much,2025-05-16 09:34:41
What's up,Hey,2025-05-16 09:35:22
hello,Hello,2025-05-16 09:46:38
what is your purpose,I am a chatbot,2025-05-16 09:47:03
what is your purpose,My purpose is to assist you,2025-05-18 23:18:20
